{
  "$schema": "https://json-schema.org/draft/2020-12/schema",
  "$id": "https://jt55401.github.io/speeeecies/schema/v0.1/locale.schema.json",
  "title": "speeeecies locale manifest v0.1",
  "description": "One place the live simulation can show, contributed as `locales/<id>/locale.json`. A locale names a public centroid (never a street address or a private yard), its climate, a generic plot template, and at least 8 species that already exist under `species/`. Flora is phase 2: `flora_wishlist` holds names only, and the simulation uses a biome default catalog until a plant format exists. Unknown keys are rejected.",
  "type": "object",
  "additionalProperties": false,
  "required": [
    "format",
    "format_version",
    "id",
    "name",
    "country",
    "activity_region",
    "public_lat",
    "public_lon",
    "tz",
    "koppen",
    "elevation_m",
    "plot_template",
    "species",
    "blurb",
    "facts"
  ],
  "properties": {
    "$schema": {
      "type": "string",
      "description": "Optional pointer to this schema, for editors."
    },
    "format": {
      "const": "speeeecies/locale"
    },
    "format_version": {
      "const": "0.1"
    },
    "id": {
      "type": "string",
      "description": "Lowercase slug, equal to the directory name: a place then a country hint, e.g. `london-uk`.",
      "pattern": "^[a-z0-9]+(-[a-z0-9]+)*$",
      "minLength": 3,
      "maxLength": 40
    },
    "name": {
      "type": "string",
      "description": "Human-readable name, e.g. `A London garden`. Name a city or district, never a street.",
      "minLength": 3,
      "maxLength": 80
    },
    "country": {
      "type": "string",
      "description": "ISO 3166-1 alpha-2 country code.",
      "pattern": "^[A-Z]{2}$"
    },
    "activity_region": {
      "type": "string",
      "description": "ISO 3166-2 (or 3166-1) code whose monthly activity curve every listed species must carry in `activity.regions[].region`. Must be `country` or a subdivision of it.",
      "pattern": "^[A-Z]{2}(-[A-Z0-9]{1,3})?$"
    },
    "public_lat": {
      "type": "number",
      "description": "Latitude of a public centroid (a city, district or park), in degrees, with at most 2 decimals (about 1 km). The validator rejects more precision.",
      "minimum": -90,
      "maximum": 90
    },
    "public_lon": {
      "type": "number",
      "description": "Longitude of a public centroid, in degrees, with at most 2 decimals.",
      "minimum": -180,
      "maximum": 180
    },
    "tz": {
      "type": "string",
      "description": "IANA time zone name, e.g. `Europe/London`.",
      "pattern": "^(UTC|[A-Z][A-Za-z_]+(/[A-Z][A-Za-z0-9_+-]+){1,2})$"
    },
    "koppen": {
      "type": "string",
      "description": "Köppen-Geiger climate class at the centroid. Picks the simulation's biome default flora until plants are supported.",
      "enum": [
        "Af",
        "Am",
        "Aw",
        "As",
        "BWh",
        "BWk",
        "BSh",
        "BSk",
        "Csa",
        "Csb",
        "Csc",
        "Cwa",
        "Cwb",
        "Cwc",
        "Cfa",
        "Cfb",
        "Cfc",
        "Dsa",
        "Dsb",
        "Dsc",
        "Dsd",
        "Dwa",
        "Dwb",
        "Dwc",
        "Dwd",
        "Dfa",
        "Dfb",
        "Dfc",
        "Dfd",
        "ET",
        "EF"
      ]
    },
    "elevation_m": {
      "type": "number",
      "description": "Elevation of the centroid in metres above sea level.",
      "minimum": -450,
      "maximum": 6000
    },
    "place_source": {
      "description": "Where `public_lat`, `public_lon`, `elevation_m` and `koppen` come from: a public page for the city or district (Wikidata and Wikipedia are fine). Optional but recommended; reviewers check the centroid against it.",
      "type": "object",
      "additionalProperties": false,
      "required": [
        "url",
        "title",
        "license"
      ],
      "properties": {
        "url": {
          "type": "string",
          "pattern": "^https://"
        },
        "title": {
          "type": "string"
        },
        "license": {
          "type": "string",
          "description": "Licence id exactly as in `schema/v0.1/licenses.json`."
        },
        "attribution": {
          "type": "string",
          "description": "Required by the validator for anything that is not CC0 or public domain."
        },
        "accessed": {
          "type": "string",
          "format": "date"
        }
      }
    },
    "plot_template": {
      "type": "string",
      "description": "Generic plot the simulation builds the scene from. No real footprints or geometry are contributed.",
      "enum": [
        "suburban-lot",
        "rural-lot",
        "rowhouse-garden",
        "street-block",
        "courtyard"
      ]
    },
    "species": {
      "type": "array",
      "description": "Slugs of species under `species/<slug>/`, at least 8. Each must carry an activity curve for `activity_region`.",
      "minItems": 8,
      "uniqueItems": true,
      "items": {
        "type": "string",
        "pattern": "^[a-z]+(-[a-z]+){1,2}$"
      }
    },
    "flora_wishlist": {
      "type": "array",
      "description": "Plants you would like to see here, by name only (scientific or common). Flora is phase 2; these are not validated or imported yet.",
      "uniqueItems": true,
      "items": {
        "type": "string",
        "minLength": 2,
        "maxLength": 80
      }
    },
    "blurb": {
      "type": "string",
      "description": "One or two sentences shown when the locale is on screen.",
      "minLength": 20,
      "maxLength": 400
    },
    "facts": {
      "type": "array",
      "description": "Short facts the simulation may show or narrate. Each carries its source and licence.",
      "minItems": 1,
      "items": {
        "type": "object",
        "additionalProperties": false,
        "required": [
          "text",
          "source"
        ],
        "properties": {
          "text": {
            "type": "string",
            "minLength": 10,
            "maxLength": 280
          },
          "source": {
            "type": "object",
            "additionalProperties": false,
            "required": [
              "url",
              "title",
              "license"
            ],
            "properties": {
              "url": {
                "type": "string",
                "pattern": "^https://"
              },
              "title": {
                "type": "string"
              },
              "license": {
                "type": "string",
                "description": "Licence id exactly as in `schema/v0.1/licenses.json`."
              },
              "attribution": {
                "type": "string",
                "description": "Required by the validator for anything that is not CC0 or public domain."
              },
              "accessed": {
                "type": "string",
                "format": "date"
              }
            }
          }
        }
      }
    },
    "contributors": {
      "type": "array",
      "description": "Who wrote the manifest, credited publicly when the locale goes live. Optional; git history is the authority.",
      "items": {
        "type": "object",
        "additionalProperties": false,
        "required": [
          "name"
        ],
        "properties": {
          "name": {
            "type": "string"
          },
          "github": {
            "type": "string"
          },
          "agent": {
            "type": "string",
            "description": "The coding agent used, if any (e.g. `claude-code`)."
          }
        }
      }
    }
  }
}
