{
  "$schema": "https://jt55401.github.io/speeeecies/schema/v0.1/locale.schema.json",
  "format": "speeeecies/locale",
  "format_version": "0.1",
  "id": "al-birmingham",
  "name": "A Birmingham street",
  "country": "US",
  "activity_region": "US-AL",
  "public_lat": 33.52,
  "public_lon": -86.81,
  "tz": "America/Chicago",
  "koppen": "Cfa",
  "elevation_m": 187,
  "place_source": {
    "url": "https://www.wikidata.org/wiki/Q79867",
    "title": "Wikidata: Birmingham, Alabama (Q79867), coordinate location and elevation above sea level",
    "license": "CC0-1.0",
    "accessed": "2026-10-01"
  },
  "plot_template": "street-block",
  "species": [
    "cardinalis-cardinalis",
    "melanerpes-carolinus",
    "thryothorus-ludovicianus",
    "baeolophus-bicolor",
    "poecile-carolinensis",
    "mimus-polyglottos",
    "colaptes-auratus",
    "sciurus-carolinensis",
    "buteo-lineatus",
    "procyon-lotor",
    "tamias-striatus",
    "anolis-carolinensis"
  ],
  "flora_wishlist": [
    "Hydrangea quercifolia",
    "Callicarpa americana",
    "Vaccinium arboreum",
    "Aesculus pavia",
    "Hibiscus coccineus",
    "Aristolochia tomentosa",
    "Chionanthus virginicus"
  ],
  "blurb": "A residential street in Birmingham, Alabama, in the Ridge-and-Valley foothills: front-yard oaks, hickories and dogwoods, hedges of American holly and eastern redcedar, and a garden visited by cardinals, chickadees and woodpeckers by day, watched over by a red-shouldered hawk, by squirrels, chipmunks and green anoles in the sun, and by raccoons after dark.",
  "facts": [
    {
      "text": "Birmingham has a humid subtropical climate (Köppen Cfa), with hot, humid summers and mild winters.",
      "source": {
        "url": "https://en.wikipedia.org/wiki/Birmingham,_Alabama",
        "title": "Wikipedia: Birmingham, Alabama",
        "license": "CC-BY-SA-4.0",
        "attribution": "Wikipedia contributors, \"Birmingham, Alabama\", English Wikipedia, CC BY-SA 4.0",
        "accessed": "2026-10-01"
      }
    },
    {
      "text": "The city sits in Jones Valley between the parallel ridges of the Appalachian foothills, drained by creeks that flow into the Black Warrior River.",
      "source": {
        "url": "https://en.wikipedia.org/wiki/Birmingham,_Alabama",
        "title": "Wikipedia: Birmingham, Alabama",
        "license": "CC-BY-SA-4.0",
        "attribution": "Wikipedia contributors, \"Birmingham, Alabama\", English Wikipedia, CC BY-SA 4.0",
        "accessed": "2026-10-01"
      }
    },
    {
      "text": "Birmingham's elevation is 187 m (614 ft) above sea level.",
      "source": {
        "url": "https://www.wikidata.org/wiki/Q79867",
        "title": "Wikidata: Birmingham, Alabama (Q79867), elevation above sea level",
        "license": "CC0-1.0",
        "accessed": "2026-10-01"
      }
    },
    {
      "text": "Birmingham was founded in 1871 and had a population of 200,733 at the 2020 census.",
      "source": {
        "url": "https://en.wikipedia.org/wiki/Birmingham,_Alabama",
        "title": "Wikipedia: Birmingham, Alabama",
        "license": "CC-BY-SA-4.0",
        "attribution": "Wikipedia contributors, \"Birmingham, Alabama\", English Wikipedia, CC BY-SA 4.0",
        "accessed": "2026-10-01"
      }
    },
    {
      "text": "Ruffner Mountain, east of downtown, is one of the largest urban nature reserves in the United States.",
      "source": {
        "url": "https://en.wikipedia.org/wiki/Birmingham,_Alabama",
        "title": "Wikipedia: Birmingham, Alabama",
        "license": "CC-BY-SA-4.0",
        "attribution": "Wikipedia contributors, \"Birmingham, Alabama\", English Wikipedia, CC BY-SA 4.0",
        "accessed": "2026-10-01"
      }
    },
    {
      "text": "The Cahaba River basin south of the city is one of the most diverse river ecosystems in the United States.",
      "source": {
        "url": "https://en.wikipedia.org/wiki/Birmingham,_Alabama",
        "title": "Wikipedia: Birmingham, Alabama",
        "license": "CC-BY-SA-4.0",
        "attribution": "Wikipedia contributors, \"Birmingham, Alabama\", English Wikipedia, CC BY-SA 4.0",
        "accessed": "2026-10-01"
      }
    }
  ],
  "contributors": [
    {
      "name": "opencode agent (al-birmingham locale, issue #73)",
      "agent": "opencode"
    }
  ]
}
