{
  "$schema": "https://jt55401.github.io/speeeecies/schema/v0.1/locale.schema.json",
  "format": "speeeecies/locale",
  "format_version": "0.1",
  "id": "nc-mountains",
  "name": "A Boone mountain lot",
  "country": "US",
  "activity_region": "US-NC",
  "public_lat": 36.22,
  "public_lon": -81.67,
  "tz": "America/New_York",
  "koppen": "Dfb",
  "elevation_m": 1015.9,
  "place_source": {
    "url": "https://www.wikidata.org/wiki/Q893055",
    "title": "Wikidata: Boone (Q893055), coordinate location (P625) and elevation above sea level (P2044)",
    "license": "CC0-1.0",
    "accessed": "2026-10-01"
  },
  "plot_template": "rural-lot",
  "species": [
    "columba-livia",
    "passer-domesticus",
    "vulpes-vulpes",
    "sciurus-carolinensis",
    "junco-hyemalis",
    "melospiza-melodia",
    "cyanocitta-cristata",
    "pipilo-erythrophthalmus",
    "odocoileus-virginianus",
    "tamias-striatus",
    "glaucomys-volans",
    "desmognathus-orestes"
  ],
  "flora_wishlist": [
    "Rhododendron maximum",
    "Kalmia latifolia",
    "Vaccinium pallidum",
    "Gaylussacia baccata",
    "Hamamelis virginiana",
    "Acer spicatum",
    "Dryopteris marginalis"
  ],
  "blurb": "A rural mountain lot on the forest edge above Boone: a mown clearing, a fence line and a woodpile backed by mixed oak, maple and hemlock, where white-tailed deer and red fox pass at dusk and juncos, towhees and jays work the leaf litter by day.",
  "facts": [
    {
      "text": "Boone is a town in and the county seat of Watauga County, in the Blue Ridge Mountains of western North Carolina.",
      "source": {
        "url": "https://en.wikipedia.org/wiki/Boone,_North_Carolina",
        "title": "Wikipedia: Boone, North Carolina",
        "license": "CC-BY-SA-4.0",
        "attribution": "Wikipedia contributors, \"Boone, North Carolina\", English Wikipedia, CC BY-SA 4.0",
        "accessed": "2026-10-01"
      }
    },
    {
      "text": "Boone has a warm-summer humid continental climate (Köppen Dfb), a rarity for the Southeastern United States, bordering on an oceanic climate.",
      "source": {
        "url": "https://en.wikipedia.org/wiki/Boone,_North_Carolina",
        "title": "Wikipedia: Boone, North Carolina",
        "license": "CC-BY-SA-4.0",
        "attribution": "Wikipedia contributors, \"Boone, North Carolina\", English Wikipedia, CC BY-SA 4.0",
        "accessed": "2026-10-01"
      }
    },
    {
      "text": "Boone lies 1,015.9 metres above sea level.",
      "source": {
        "url": "https://www.wikidata.org/wiki/Q893055",
        "title": "Wikidata: Boone (Q893055), elevation above sea level (P2044)",
        "license": "CC0-1.0",
        "accessed": "2026-10-01"
      }
    },
    {
      "text": "Boone has the highest elevation of any town of its size (over 10,000 population) east of the Mississippi River.",
      "source": {
        "url": "https://en.wikipedia.org/wiki/Boone,_North_Carolina",
        "title": "Wikipedia: Boone, North Carolina",
        "license": "CC-BY-SA-4.0",
        "attribution": "Wikipedia contributors, \"Boone, North Carolina\", English Wikipedia, CC BY-SA 4.0",
        "accessed": "2026-10-01"
      }
    },
    {
      "text": "Winters are long and cold with frequent sleet and snowfall; Boone averages nearly 25 inches of snow a year, far more than North Carolina's lowlands.",
      "source": {
        "url": "https://en.wikipedia.org/wiki/Boone,_North_Carolina",
        "title": "Wikipedia: Boone, North Carolina",
        "license": "CC-BY-SA-4.0",
        "attribution": "Wikipedia contributors, \"Boone, North Carolina\", English Wikipedia, CC BY-SA 4.0",
        "accessed": "2026-10-01"
      }
    },
    {
      "text": "Salamander diversity is highest in eastern North America, especially in the Appalachian Mountains.",
      "source": {
        "url": "https://en.wikipedia.org/wiki/Salamander",
        "title": "Wikipedia: Salamander",
        "license": "CC-BY-SA-4.0",
        "attribution": "Wikipedia contributors, \"Salamander\", English Wikipedia, CC BY-SA 4.0",
        "accessed": "2026-10-01"
      }
    },
    {
      "text": "Boone's population was 19,092 at the 2020 census, and the town is home to Appalachian State University.",
      "source": {
        "url": "https://en.wikipedia.org/wiki/Boone,_North_Carolina",
        "title": "Wikipedia: Boone, North Carolina",
        "license": "CC-BY-SA-4.0",
        "attribution": "Wikipedia contributors, \"Boone, North Carolina\", English Wikipedia, CC BY-SA 4.0",
        "accessed": "2026-10-01"
      }
    }
  ],
  "contributors": [
    {
      "name": "speeeecies fleet",
      "agent": "opencode"
    }
  ]
}
