{
  "$schema": "https://jt55401.github.io/speeeecies/schema/v0.1/locale.schema.json",
  "format": "speeeecies/locale",
  "format_version": "0.1",
  "id": "nm-mesilla",
  "name": "A Las Cruces lot",
  "country": "US",
  "activity_region": "US-NM",
  "public_lat": 32.31,
  "public_lon": -106.78,
  "tz": "America/Denver",
  "koppen": "BWk",
  "elevation_m": 1191,
  "place_source": {
    "url": "https://www.wikidata.org/wiki/Q33264",
    "title": "Wikidata: Las Cruces (Q33264), coordinate location and elevation above sea level",
    "license": "CC0-1.0",
    "accessed": "2026-10-01"
  },
  "plot_template": "suburban-lot",
  "species": [
    "zenaida-asiatica",
    "quiscalus-mexicanus",
    "geococcyx-californianus",
    "callipepla-gambelii",
    "haemorhous-mexicanus",
    "toxostoma-curvirostre",
    "melozone-fusca",
    "archilochus-alexandri",
    "sylvilagus-audubonii",
    "otospermophilus-variegatus",
    "antrozous-pallidus",
    "urosaurus-ornatus"
  ],
  "flora_wishlist": [
    "Parkinsonia aculeata",
    "Larrea tridentata",
    "Fouquieria splendens",
    "Eysenhardtia orthocarpa",
    "Atriplex canescens",
    "Nicotiana glauca",
    "Baileya multiradiata"
  ],
  "blurb": "A fenced suburban lot on the edge of the Mesilla Valley: gravel and bare soil instead of a lawn, watered only in a strip by the house, with mesquite, a yucca and agave round the edges and an apple for shade. Doves and grackles work the ground, quail walk the gravel, roadrunners patrol the fence line, and after dark a pallid bat leaves the porch eave to hunt scorpions over the dust.",
  "facts": [
    {
      "text": "Las Cruces has a cool desert climate (Köppen BWk).",
      "source": {
        "url": "https://en.wikipedia.org/wiki/Las_Cruces,_New_Mexico",
        "title": "Wikipedia: Las Cruces, New Mexico",
        "license": "CC-BY-SA-4.0",
        "attribution": "Wikipedia contributors, \"Las Cruces, New Mexico\", English Wikipedia, CC BY-SA 4.0",
        "accessed": "2026-10-01"
      }
    },
    {
      "text": "Las Cruces is the economic and geographic centre of the Mesilla Valley, the agricultural region on the floodplain of the Rio Grande, and lies in Doña Ana County at about 1,191 metres above sea level.",
      "source": {
        "url": "https://en.wikipedia.org/wiki/Las_Cruces,_New_Mexico",
        "title": "Wikipedia: Las Cruces, New Mexico",
        "license": "CC-BY-SA-4.0",
        "attribution": "Wikipedia contributors, \"Las Cruces, New Mexico\", English Wikipedia, CC BY-SA 4.0",
        "accessed": "2026-10-01"
      }
    },
    {
      "text": "The Chihuahuan Desert's dominant plant is the creosote bush, and yucca and numerous Opuntia cacti are abundant on slopes and uplands through most of it.",
      "source": {
        "url": "https://en.wikipedia.org/wiki/Chihuahuan_Desert",
        "title": "Wikipedia: Chihuahuan Desert",
        "license": "CC-BY-SA-4.0",
        "attribution": "Wikipedia contributors, \"Chihuahuan Desert\", English Wikipedia, CC BY-SA 4.0",
        "accessed": "2026-10-01"
      }
    },
    {
      "text": "The Chihuahuan Desert receives about 235 mm of rain a year, more than most other warm desert ecoregions, which is enough for mesquite and cottonwood to grow along the river.",
      "source": {
        "url": "https://en.wikipedia.org/wiki/Chihuahuan_Desert",
        "title": "Wikipedia: Chihuahuan Desert",
        "license": "CC-BY-SA-4.0",
        "attribution": "Wikipedia contributors, \"Chihuahuan Desert\", English Wikipedia, CC BY-SA 4.0",
        "accessed": "2026-10-01"
      }
    },
    {
      "text": "The greater roadrunner is New Mexico's state bird, and is abundant in the southeast of the state.",
      "source": {
        "url": "https://en.wikipedia.org/wiki/New_Mexico",
        "title": "Wikipedia: New Mexico",
        "license": "CC-BY-SA-4.0",
        "attribution": "Wikipedia contributors, \"New Mexico\", English Wikipedia, CC BY-SA 4.0",
        "accessed": "2026-10-01"
      }
    },
    {
      "text": "The white-winged dove is popular as a game bird, and has proved adaptable to human environments, expanding outside its historic range into northern New Mexico.",
      "source": {
        "url": "https://en.wikipedia.org/wiki/White-winged_dove",
        "title": "Wikipedia: White-winged dove",
        "license": "CC-BY-SA-4.0",
        "attribution": "Wikipedia contributors, \"White-winged dove\", English Wikipedia, CC BY-SA 4.0",
        "accessed": "2026-10-01"
      }
    },
    {
      "text": "Pallid bats eat Arizona bark scorpions, the most venomous scorpions in North America, and carry missense mutations in their voltage-gated sodium channels that appear to be responsible for that resistance.",
      "source": {
        "url": "https://en.wikipedia.org/wiki/Pallid_bat",
        "title": "Wikipedia: Pallid bat",
        "license": "CC-BY-SA-4.0",
        "attribution": "Wikipedia contributors, \"Pallid bat\", English Wikipedia, CC BY-SA 4.0",
        "accessed": "2026-10-01"
      }
    }
  ],
  "contributors": [
    {
      "name": "speeeecies maintainers",
      "agent": "claude-code"
    }
  ]
}
