{
  "$schema": "https://jt55401.github.io/speeeecies/schema/v0.1/locale.schema.json",
  "format": "speeeecies/locale",
  "format_version": "0.1",
  "id": "seoul-kr",
  "name": "A Seoul apartment green",
  "country": "KR",
  "activity_region": "KR-11",
  "public_lat": 37.56,
  "public_lon": 126.99,
  "tz": "Asia/Seoul",
  "koppen": "Dwa",
  "elevation_m": 38,
  "place_source": {
    "url": "https://www.wikidata.org/wiki/Q8684",
    "title": "Wikidata: Seoul (Q8684), coordinate location and elevation above sea level",
    "license": "CC0-1.0",
    "accessed": "2026-10-01"
  },
  "plot_template": "courtyard",
  "species": [
    "pica-serica",
    "hypsipetes-amaurotis",
    "streptopelia-orientalis",
    "passer-montanus",
    "parus-minor",
    "cyanopica-cyanus",
    "corvus-macrorhynchos",
    "sciurus-vulgaris",
    "nyctereutes-procyonoides",
    "tamias-sibiricus",
    "dryophytes-japonicus",
    "pelophylax-nigromaculatus"
  ],
  "flora_wishlist": [
    "Forsythia koreana",
    "Rhododendron yedoense",
    "Hosta sieboldiana",
    "Chlorophytum comosum"
  ],
  "blurb": "A small courtyard garden between Seoul apartment blocks: a paved area with potted plants, a few trees along the fence, and a shallow water feature, visited by magpies, sparrows, bulbuls and crows by day and by raccoon dogs after dark.",
  "facts": [
    {
      "text": "Seoul has a humid continental climate (Köppen Dwa) with cold, dry winters and hot, humid summers.",
      "source": {
        "url": "https://en.wikipedia.org/wiki/Seoul",
        "title": "Wikipedia: Seoul",
        "license": "CC-BY-SA-4.0",
        "attribution": "Wikipedia contributors, \"Seoul\", English Wikipedia, CC BY-SA 4.0",
        "accessed": "2026-10-01"
      }
    },
    {
      "text": "Seoul is the capital and largest city of South Korea, with a population of about 9.7 million people.",
      "source": {
        "url": "https://en.wikipedia.org/wiki/Seoul",
        "title": "Wikipedia: Seoul",
        "license": "CC-BY-SA-4.0",
        "attribution": "Wikipedia contributors, \"Seoul\", English Wikipedia, CC BY-SA 4.0",
        "accessed": "2026-10-01"
      }
    },
    {
      "text": "The Oriental magpie (Pica serica) is a common and conspicuous bird in Seoul's parks and gardens, and is the national bird of South Korea.",
      "source": {
        "url": "https://en.wikipedia.org/wiki/Oriental_magpie",
        "title": "Wikipedia: Oriental magpie",
        "license": "CC-BY-SA-4.0",
        "attribution": "Wikipedia contributors, \"Oriental magpie\", English Wikipedia, CC BY-SA 4.0",
        "accessed": "2026-10-01"
      }
    },
    {
      "text": "The raccoon dog (Nyctereutes procyonoides) is a nocturnal canid native to East Asia that adapts well to urban environments and is occasionally seen in Seoul's green spaces.",
      "source": {
        "url": "https://en.wikipedia.org/wiki/Raccoon_dog",
        "title": "Wikipedia: Raccoon dog",
        "license": "CC-BY-SA-4.0",
        "attribution": "Wikipedia contributors, \"Raccoon dog\", English Wikipedia, CC BY-SA 4.0",
        "accessed": "2026-10-01"
      }
    }
  ],
  "contributors": [
    {
      "name": "speeeecies maintainers",
      "agent": "claude-code"
    }
  ]
}
