{
  "$schema": "https://eeeearth.github.io/speeeecies/schema/v0.1/locale.schema.json",
  "format": "speeeecies/locale",
  "format_version": "0.1",
  "id": "la-shreveport",
  "name": "A Shreveport lot",
  "country": "US",
  "activity_region": "US-LA",
  "public_lat": 32.51,
  "public_lon": -93.76,
  "tz": "America/Chicago",
  "koppen": "Cfa",
  "elevation_m": 46,
  "place_source": {
    "url": "https://www.wikidata.org/wiki/Q80517",
    "title": "Wikidata: Shreveport (Q80517), coordinate location and elevation above sea level",
    "license": "CC0-1.0",
    "accessed": "2026-09-30"
  },
  "plot_template": "suburban-lot",
  "species": [
    "sciurus-carolinensis",
    "didelphis-virginiana",
    "dasypus-mexicanus",
    "vulpes-vulpes",
    "columba-livia",
    "passer-domesticus",
    "mimus-polyglottos",
    "cardinalis-cardinalis",
    "turdus-migratorius",
    "sialia-sialis",
    "thryothorus-ludovicianus",
    "dryophytes-cinereus"
  ],
  "flora_wishlist": [
    "Lagerstroemia indica",
    "Sabal minor",
    "Ligustrum sinense",
    "Viburnum nudum",
    "Itea virginica"
  ],
  "blurb": "A suburban lot in Shreveport: a mown lawn, a fenceline of American holly and sugarberry, a loblolly pine in the back corner, cardinals and mockingbirds by day and opossums, armadillos and a red fox after dark.",
  "facts": [
    {
      "text": "Shreveport has a humid subtropical climate (Köppen Cfa): hot, humid summers and mild winters.",
      "source": {
        "url": "https://en.wikipedia.org/wiki/Shreveport,_Louisiana",
        "title": "Wikipedia: Shreveport, Louisiana",
        "license": "CC-BY-SA-4.0",
        "attribution": "Wikipedia contributors, \"Shreveport, Louisiana\", English Wikipedia, CC BY-SA 4.0",
        "accessed": "2026-09-30"
      }
    },
    {
      "text": "Summer highs exceed 90 °F (32 °C) on an average of 91 days a year, while winters are mild, with about 35 days of freezing temperatures.",
      "source": {
        "url": "https://en.wikipedia.org/wiki/Shreveport,_Louisiana",
        "title": "Wikipedia: Shreveport, Louisiana",
        "license": "CC-BY-SA-4.0",
        "attribution": "Wikipedia contributors, \"Shreveport, Louisiana\", English Wikipedia, CC BY-SA 4.0",
        "accessed": "2026-09-30"
      }
    },
    {
      "text": "Annual precipitation averages over 51 inches (1,300 mm), peaking in late spring and easing in late summer.",
      "source": {
        "url": "https://en.wikipedia.org/wiki/Shreveport,_Louisiana",
        "title": "Wikipedia: Shreveport, Louisiana",
        "license": "CC-BY-SA-4.0",
        "attribution": "Wikipedia contributors, \"Shreveport, Louisiana\", English Wikipedia, CC BY-SA 4.0",
        "accessed": "2026-09-30"
      }
    },
    {
      "text": "The bulk of Shreveport lies in Caddo Parish, along the west bank of the Red River, and the 2020 census counted 187,593 people in the city.",
      "source": {
        "url": "https://en.wikipedia.org/wiki/Shreveport,_Louisiana",
        "title": "Wikipedia: Shreveport, Louisiana",
        "license": "CC-BY-SA-4.0",
        "attribution": "Wikipedia contributors, \"Shreveport, Louisiana\", English Wikipedia, CC BY-SA 4.0",
        "accessed": "2026-09-30"
      }
    },
    {
      "text": "The city stands about 46 m above sea level.",
      "source": {
        "url": "https://www.wikidata.org/wiki/Q80517",
        "title": "Wikidata: Shreveport (Q80517)",
        "license": "CC0-1.0",
        "accessed": "2026-09-30"
      }
    }
  ],
  "contributors": [
    {
      "name": "Sisyphus (opencode)",
      "agent": "opencode"
    }
  ]
}
