{
  "$schema": "https://jt55401.github.io/speeeecies/schema/v0.1/locale.schema.json",
  "format": "speeeecies/locale",
  "format_version": "0.1",
  "id": "ma-berkshires",
  "name": "A Great Barrington woodland lot",
  "country": "US",
  "activity_region": "US-MA",
  "public_lat": 42.2,
  "public_lon": -73.36,
  "tz": "America/New_York",
  "koppen": "Dfb",
  "elevation_m": 221,
  "place_source": {
    "url": "https://www.wikidata.org/wiki/Q1144518",
    "title": "Wikidata: Great Barrington, Massachusetts (Q1144518), coordinate location and elevation above sea level",
    "license": "CC0-1.0",
    "accessed": "2026-10-01"
  },
  "plot_template": "rural-lot",
  "species": [
    "meleagris-gallopavo",
    "sayornis-phoebe",
    "poecile-atricapillus",
    "cyanocitta-cristata",
    "sialia-sialis",
    "strix-varia",
    "tamias-striatus",
    "erethizon-dorsatus",
    "vulpes-vulpes",
    "eptesicus-fuscus",
    "notophthalmus-viridescens",
    "anaxyrus-americanus"
  ],
  "flora_wishlist": [
    "Trillium erectum",
    "Asclepias syriaca",
    "Matteuccia struthiopteris",
    "Echinacea purpurea"
  ],
  "blurb": "A woodland lot in the Berkshire hills near Great Barrington: sugar maple, oak and hemlock around a rural plot, with chickadees, blue jays and wild turkeys by day and foxes, a barred owl and big brown bats after dark.",
  "facts": [
    {
      "text": "Great Barrington is a town in Berkshire County, Massachusetts, set in the Berkshire hills along the Housatonic River.",
      "source": {
        "url": "https://en.wikipedia.org/wiki/Great_Barrington,_Massachusetts",
        "title": "Wikipedia: Great Barrington, Massachusetts",
        "license": "CC-BY-SA-4.0",
        "attribution": "Wikipedia contributors, \"Great Barrington, Massachusetts\", English Wikipedia, CC BY-SA 4.0",
        "accessed": "2026-10-01"
      }
    },
    {
      "text": "The town has a humid continental climate (Köppen Dfb), with cold winters and warm summers.",
      "source": {
        "url": "https://www.gloh2o.org/koppen/",
        "title": "Beck et al. 2018, Köppen-Geiger climate classification map",
        "license": "CC-BY-4.0",
        "attribution": "Beck, H. E. et al. (2018), Present and future Köppen-Geiger climate classification maps, CC BY 4.0",
        "accessed": "2026-10-01"
      }
    },
    {
      "text": "Great Barrington is a rural, wooded resort town, long a summer retreat and now also home to a ski area on the surrounding hills.",
      "source": {
        "url": "https://en.wikipedia.org/wiki/Great_Barrington,_Massachusetts",
        "title": "Wikipedia: Great Barrington, Massachusetts",
        "license": "CC-BY-SA-4.0",
        "attribution": "Wikipedia contributors, \"Great Barrington, Massachusetts\", English Wikipedia, CC BY-SA 4.0",
        "accessed": "2026-10-01"
      }
    },
    {
      "text": "The Berkshire hills are noted for their northern hardwood forest of sugar maple, American beech and yellow birch.",
      "source": {
        "url": "https://en.wikipedia.org/wiki/Berkshires",
        "title": "Wikipedia: Berkshires",
        "license": "CC-BY-SA-4.0",
        "attribution": "Wikipedia contributors, \"Berkshires\", English Wikipedia, CC BY-SA 4.0",
        "accessed": "2026-10-01"
      }
    }
  ],
  "contributors": [
    {
      "name": "speeeecies maintainers",
      "agent": "claude-code"
    }
  ]
}
