{
  "$schema": "https://eeeearth.github.io/speeeecies/schema/v0.1/locale.schema.json",
  "format": "speeeecies/locale",
  "format_version": "0.1",
  "id": "toronto-ca",
  "name": "A Toronto lot",
  "country": "CA",
  "activity_region": "CA-ON",
  "public_lat": 43.67,
  "public_lon": -79.39,
  "tz": "America/Toronto",
  "koppen": "Dfa",
  "elevation_m": 76,
  "place_source": {
    "url": "https://www.wikidata.org/wiki/Q172",
    "title": "Wikidata: Toronto (Q172), coordinate location and elevation above sea level",
    "license": "CC0-1.0",
    "accessed": "2026-10-01"
  },
  "plot_template": "suburban-lot",
  "species": [
    "turdus-migratorius",
    "cardinalis-cardinalis",
    "passer-domesticus",
    "agelaius-phoeniceus",
    "columba-livia",
    "sialia-sialis",
    "haliaeetus-leucocephalus",
    "dryobates-pubescens",
    "poecile-atricapillus",
    "sciurus-carolinensis",
    "sciurus-niger",
    "tamias-striatus",
    "procyon-lotor",
    "blarina-brevicauda",
    "vulpes-vulpes",
    "chrysemys-picta",
    "nerodia-sipedon"
  ],
  "flora_wishlist": [
    "Cornus sericea",
    "Amelanchier canadensis",
    "Corylus cornuta",
    "Syringa vulgaris",
    "Rhus typhina",
    "Asclepias syriaca",
    "Echinacea purpurea",
    "Rudbeckia hirta",
    "Schizachyrium scoparium",
    "Matteuccia struthiopteris"
  ],
  "blurb": "A suburban Toronto lot on the Ontario plain: maples and redcedar over a lawn and shrub border, with a ravine edge of hemlock and yew behind, visited by robins, cardinals, chickadees and woodpeckers by day, by squirrels, chipmunks and raccoons after dark, and by painted turtles and northern water snakes where the garden pond meets the water table.",
  "facts": [
    {
      "text": "Toronto has a hot summer humid continental climate (Köppen: Dfa), with warm, humid summers and cold winters.",
      "source": {
        "url": "https://en.wikipedia.org/wiki/Toronto",
        "title": "Wikipedia: Toronto",
        "license": "CC-BY-SA-4.0",
        "attribution": "Wikipedia contributors, \"Toronto\", English Wikipedia, CC BY-SA 4.0",
        "accessed": "2026-10-01"
      }
    },
    {
      "text": "In the classification applied by Natural Resources Canada, the city of Toronto is in plant hardiness zone 7a, and some suburbs and nearby towns have lower zone ratings.",
      "source": {
        "url": "https://en.wikipedia.org/wiki/Toronto",
        "title": "Wikipedia: Toronto",
        "license": "CC-BY-SA-4.0",
        "attribution": "Wikipedia contributors, \"Toronto\", English Wikipedia, CC BY-SA 4.0",
        "accessed": "2026-10-01"
      }
    },
    {
      "text": "Most ravine lands and river bank floodplains in Toronto are public parklands, which is where the city's mature tree cover survives.",
      "source": {
        "url": "https://en.wikipedia.org/wiki/Toronto",
        "title": "Wikipedia: Toronto",
        "license": "CC-BY-SA-4.0",
        "attribution": "Wikipedia contributors, \"Toronto\", English Wikipedia, CC BY-SA 4.0",
        "accessed": "2026-10-01"
      }
    },
    {
      "text": "Since the 1950s raccoons have been present in metropolitan areas including Toronto, where the species uses urban areas as habitat.",
      "source": {
        "url": "https://en.wikipedia.org/wiki/Raccoon",
        "title": "Wikipedia: Raccoon",
        "license": "CC-BY-SA-4.0",
        "attribution": "Wikipedia contributors, \"Raccoon\", English Wikipedia, CC BY-SA 4.0",
        "accessed": "2026-10-01"
      }
    },
    {
      "text": "The black, melanistic form of the eastern gray squirrel predominates in large parts of southeastern Canada, and black squirrels are frequently seen in Toronto's ravines and yards.",
      "source": {
        "url": "https://en.wikipedia.org/wiki/Eastern_gray_squirrel",
        "title": "Wikipedia: Eastern gray squirrel",
        "license": "CC-BY-SA-4.0",
        "attribution": "Wikipedia contributors, \"Eastern gray squirrel\", English Wikipedia, CC BY-SA 4.0",
        "accessed": "2026-10-01"
      }
    },
    {
      "text": "In March 2024, bald eagles were found nesting in Toronto for the first time.",
      "source": {
        "url": "https://en.wikipedia.org/wiki/Bald_eagle",
        "title": "Wikipedia: Bald eagle",
        "license": "CC-BY-SA-4.0",
        "attribution": "Wikipedia contributors, \"Bald eagle\", English Wikipedia, CC BY-SA 4.0",
        "accessed": "2026-10-01"
      }
    }
  ],
  "contributors": [
    {
      "name": "speeeecies maintainers",
      "agent": "opencode"
    }
  ]
}