{
  "$schema": "https://jt55401.github.io/speeeecies/schema/v0.1/locale.schema.json",
  "format": "speeeecies/locale",
  "format_version": "0.1",
  "id": "chiangmai-th",
  "name": "A Chiang Mai garden",
  "country": "TH",
  "activity_region": "TH-50",
  "public_lat": 18.79,
  "public_lon": 98.98,
  "tz": "Asia/Bangkok",
  "koppen": "Aw",
  "elevation_m": 310,
  "place_source": {
    "url": "https://www.wikidata.org/wiki/Q52028",
    "title": "Wikidata: Chiang Mai (Q52028), coordinate location and elevation above sea level",
    "license": "CC0-1.0",
    "accessed": "2026-10-01"
  },
  "plot_template": "suburban-lot",
  "species": [
    "pycnonotus-jocosus",
    "pycnonotus-aurigaster",
    "spilopelia-chinensis",
    "acridotheres-tristis",
    "copsychus-saularis",
    "passer-montanus",
    "orthotomus-sutorius",
    "callosciurus-finlaysonii",
    "tamiops-mcclellandii",
    "duttaphrynus-melanostictus",
    "hemidactylus-platyurus"
  ],
  "flora_wishlist": [
    "Plumeria rubra",
    "Bougainvillea spectabilis",
    "Musa balbisiana",
    "Canna indica",
    "Jasminum sambac",
    "Cymbopogon citratus",
    "Bambusa bambos"
  ],
  "blurb": "A suburban garden in Chiang Mai, northern Thailand: mango and jackfruit trees shade a lawn of tropical grass, a small pond attracts toads at night, and bougainvillea drapes the walls. Red-whiskered bulbuls and spotted doves forage by day; Asian common toads call from the pond edges after dark, while house geckos hunt under the porch lights.",
  "facts": [
    {
      "text": "Chiang Mai has a tropical savanna climate (Köppen Aw), warm to hot year-round with a pronounced dry season and a monsoon wet season.",
      "source": {
        "url": "https://en.wikipedia.org/wiki/Chiang_Mai",
        "title": "Wikipedia: Chiang Mai",
        "license": "CC-BY-SA-4.0",
        "attribution": "Wikipedia contributors, \"Chiang Mai\", English Wikipedia, CC BY-SA 4.0",
        "accessed": "2026-10-01"
      }
    },
    {
      "text": "Chiang Mai is the largest city in northern Thailand and lies at an average elevation of about 310 m in the Thai highlands.",
      "source": {
        "url": "https://www.wikidata.org/wiki/Q52028",
        "title": "Wikidata: Chiang Mai (Q52028), elevation above sea level",
        "license": "CC0-1.0",
        "accessed": "2026-10-01"
      }
    },
    {
      "text": "The city sits on the Ping River, a major tributary of the Chao Phraya, and the temple of Wat Phra That Doi Suthep stands on the mountain of the same name at 1,073 m to the north-west.",
      "source": {
        "url": "https://en.wikipedia.org/wiki/Chiang_Mai",
        "title": "Wikipedia: Chiang Mai",
        "license": "CC-BY-SA-4.0",
        "attribution": "Wikipedia contributors, \"Chiang Mai\", English Wikipedia, CC BY-SA 4.0",
        "accessed": "2026-10-01"
      }
    },
    {
      "text": "The red-whiskered bulbul is a resident frugivore common in urban gardens and hill forests across tropical Asia, feeding on fruits and small insects and perching conspicuously on trees.",
      "source": {
        "url": "https://en.wikipedia.org/wiki/Red-whiskered_bulbul",
        "title": "Wikipedia: Red-whiskered bulbul",
        "license": "CC-BY-SA-4.0",
        "attribution": "Wikipedia contributors, \"Red-whiskered bulbul\", English Wikipedia, CC BY-SA 4.0",
        "accessed": "2026-10-01"
      }
    },
    {
      "text": "The Asian common toad lives mostly in disturbed lowland habitats across South and Southeast Asia, breeds in still and slow-flowing water during the monsoon, and is often seen at night under street lamps.",
      "source": {
        "url": "https://en.wikipedia.org/wiki/Duttaphrynus_melanostictus",
        "title": "Wikipedia: Duttaphrynus melanostictus",
        "license": "CC-BY-SA-4.0",
        "attribution": "Wikipedia contributors, \"Duttaphrynus melanostictus\", English Wikipedia, CC BY-SA 4.0",
        "accessed": "2026-10-01"
      }
    },
    {
      "text": "Finlayson's squirrel occurs in a wide range of wooded habitats in Thailand and neighbouring countries, including gardens and parks in cities, and is normally a canopy-dweller feeding mainly on fruit.",
      "source": {
        "url": "https://en.wikipedia.org/wiki/Finlayson%27s_squirrel",
        "title": "Wikipedia: Finlayson's squirrel",
        "license": "CC-BY-SA-4.0",
        "attribution": "Wikipedia contributors, \"Finlayson's squirrel\", English Wikipedia, CC BY-SA 4.0",
        "accessed": "2026-10-01"
      }
    }
  ],
  "contributors": [
    {
      "name": "speeeecies locale agent",
      "agent": "opencode"
    }
  ]
}
