{
  "$schema": "https://eeeearth.github.io/speeeecies/schema/v0.1/locale.schema.json",
  "format": "speeeecies/locale",
  "format_version": "0.1",
  "id": "oh-sandusky",
  "name": "A Sandusky shore lot",
  "country": "US",
  "activity_region": "US-OH",
  "public_lat": 41.45,
  "public_lon": -82.71,
  "tz": "America/New_York",
  "koppen": "Dfa",
  "elevation_m": 182,
  "place_source": {
    "url": "https://www.wikidata.org/wiki/Q608207",
    "title": "Wikidata: Sandusky, Ohio (Q608207), coordinate location and elevation above sea level",
    "license": "CC0-1.0",
    "accessed": "2026-10-01"
  },
  "plot_template": "suburban-lot",
  "species": [
    "haliaeetus-leucocephalus",
    "ardea-herodias",
    "larus-delawarensis",
    "agelaius-phoeniceus",
    "tachycineta-bicolor",
    "melanerpes-erythrocephalus",
    "sciurus-niger",
    "procyon-lotor",
    "blarina-brevicauda",
    "lasiurus-borealis",
    "nerodia-sipedon",
    "chrysemys-picta"
  ],
  "flora_wishlist": [
    "Typha latifolia",
    "Schoenoplectus tabernaemontani",
    "Phragmites australis",
    "Nymphaea odorata",
    "Pontederia cordata",
    "Lythrum salicaria",
    "Rhus typhina",
    "Vitis riparia",
    "Parthenocissus quinquefolia",
    "Aronia arbutifolia"
  ],
  "blurb": "A suburban lot on the low shore of Sandusky Bay, Lake Erie: lawn to the road, white cedar and redcedar along the back fence, a buckeye and a serviceberry in the middle, and the water a few steps past the end of the drive, where herons and gulls work the shallows, a fox squirrel runs the oak line, and raccoons and a bat come in off the beach after dark.",
  "facts": [
    {
      "text": "Sandusky has a humid continental climate (Köppen Dfa), typical of the Midwestern United States, with warm summers and cold winters.",
      "source": {
        "url": "https://en.wikipedia.org/wiki/Sandusky,_Ohio",
        "title": "Wikipedia: Sandusky, Ohio",
        "license": "CC-BY-SA-4.0",
        "attribution": "Wikipedia contributors, \"Sandusky, Ohio\", English Wikipedia, CC BY-SA 4.0",
        "accessed": "2026-10-01"
      }
    },
    {
      "text": "Sandusky sits on the southern shore of Lake Erie at the head of Sandusky Bay, and averages 23.3 inches (59 cm) of snow a winter.",
      "source": {
        "url": "https://en.wikipedia.org/wiki/Sandusky,_Ohio",
        "title": "Wikipedia: Sandusky, Ohio",
        "license": "CC-BY-SA-4.0",
        "attribution": "Wikipedia contributors, \"Sandusky, Ohio\", English Wikipedia, CC BY-SA 4.0",
        "accessed": "2026-10-01"
      }
    },
    {
      "text": "The city had 25,095 residents at the 2020 census, and the Sandusky metropolitan area 115,986.",
      "source": {
        "url": "https://en.wikipedia.org/wiki/Sandusky,_Ohio",
        "title": "Wikipedia: Sandusky, Ohio",
        "license": "CC-BY-SA-4.0",
        "attribution": "Wikipedia contributors, \"Sandusky, Ohio\", English Wikipedia, CC BY-SA 4.0",
        "accessed": "2026-10-01"
      }
    },
    {
      "text": "Ohio is red-winged blackbird country: a Wood County study of 1964-1968 found territorial males at 2.89 times the density in wetland habitat as in upland.",
      "source": {
        "url": "https://en.wikipedia.org/wiki/Red-winged_blackbird",
        "title": "Wikipedia: Red-winged blackbird",
        "license": "CC-BY-SA-4.0",
        "attribution": "Wikipedia contributors, \"Red-winged blackbird\", English Wikipedia, CC BY-SA 4.0",
        "accessed": "2026-10-01"
      }
    },
    {
      "text": "Eastern fox squirrels in Ohio rank their food: white oak acorns first, then black oak acorns, red oak acorns, walnuts, and corn.",
      "source": {
        "url": "https://en.wikipedia.org/wiki/Eastern_fox_squirrel",
        "title": "Wikipedia: Eastern fox squirrel",
        "license": "CC-BY-SA-4.0",
        "attribution": "Wikipedia contributors, \"Eastern fox squirrel\", English Wikipedia, CC BY-SA 4.0",
        "accessed": "2026-10-01"
      }
    },
    {
      "text": "The Lake Erie watersnake, which lives mainly on the islands offshore from Ohio, came off the US endangered species list in 2011 after it recovered.",
      "source": {
        "url": "https://en.wikipedia.org/wiki/Northern_water_snake",
        "title": "Wikipedia: Northern water snake",
        "license": "CC-BY-SA-4.0",
        "attribution": "Wikipedia contributors, \"Northern water snake\", English Wikipedia, CC BY-SA 4.0",
        "accessed": "2026-10-01"
      }
    },
    {
      "text": "The longest-running painted turtle study, in Michigan, found the animals can live more than 55 years.",
      "source": {
        "url": "https://en.wikipedia.org/wiki/Painted_turtle",
        "title": "Wikipedia: Painted turtle",
        "license": "CC-BY-SA-4.0",
        "attribution": "Wikipedia contributors, \"Painted turtle\", English Wikipedia, CC BY-SA 4.0",
        "accessed": "2026-10-01"
      }
    },
    {
      "text": "Red-headed woodpeckers declined more than 1.5% a year from 1966 to 2015 along the Mississippi and Ohio river valleys.",
      "source": {
        "url": "https://en.wikipedia.org/wiki/Red-headed_woodpecker",
        "title": "Wikipedia: Red-headed woodpecker",
        "license": "CC-BY-SA-4.0",
        "attribution": "Wikipedia contributors, \"Red-headed woodpecker\", English Wikipedia, CC BY-SA 4.0",
        "accessed": "2026-10-01"
      }
    }
  ],
  "contributors": [
    {
      "name": "speeeecies maintainers",
      "agent": "opencode"
    }
  ]
}
