{
  "$schema": "https://jt55401.github.io/speeeecies/schema/v0.1/locale.schema.json",
  "format": "speeeecies/locale",
  "format_version": "0.1",
  "id": "buenosaires-ar",
  "name": "A Buenos Aires patio",
  "country": "AR",
  "activity_region": "AR-C",
  "public_lat": -34.6,
  "public_lon": -58.38,
  "tz": "America/Argentina/Buenos_Aires",
  "koppen": "Cfa",
  "elevation_m": 25,
  "place_source": {
    "url": "https://www.wikidata.org/wiki/Q1486",
    "title": "Wikidata: Buenos Aires (Q1486), coordinate location and elevation above sea level",
    "license": "CC0-1.0",
    "accessed": "2026-10-01"
  },
  "plot_template": "courtyard",
  "species": [
    "furnarius-rufus",
    "pitangus-sulphuratus",
    "turdus-rufiventris",
    "mimus-saturninus",
    "patagioenas-picazuro",
    "zenaida-auriculata",
    "myiopsitta-monachus",
    "zonotrichia-capensis",
    "passer-domesticus",
    "didelphis-albiventris",
    "rattus-norvegicus",
    "salvator-merianae"
  ],
  "flora_wishlist": [
    "Jacaranda mimosifolia",
    "Tipuana tipu",
    "Citrus × sinensis",
    "Morus alba",
    "Ficus microcarpa",
    "Celtis taylorii",
    "Platanus × acerifolia",
    "Cortaderia selloana",
    "Araucaria angustifolia"
  ],
  "blurb": "A walled courtyard behind a two-storey Buenos Aires house: paved, with a strip of earth along the wall, a naranjo and a peach in the corner, a privet clipped flat against the street side, a maguey by the step. Pairs of horneros work an old clay oven on the wall, chingolos work the open ground, big picazuro pigeons come down from the trees, and after dark a zarigüeya noses along the bins.",
  "facts": [
    {
      "text": "Under the Köppen climate classification, Buenos Aires has a humid subtropical climate (Cfa).",
      "source": {
        "url": "https://en.wikipedia.org/wiki/Buenos_Aires",
        "title": "Wikipedia: Buenos Aires",
        "license": "CC-BY-SA-4.0",
        "attribution": "Wikipedia contributors, \"Buenos Aires\", English Wikipedia, CC BY-SA 4.0",
        "accessed": "2026-10-01"
      }
    },
    {
      "text": "As a result of maritime influences from the adjoining Atlantic Ocean, the climate is temperate with extreme temperatures being rare; summers are hot and humid and winters are rather cool with mild temperatures during the day and chilly nights.",
      "source": {
        "url": "https://en.wikipedia.org/wiki/Buenos_Aires",
        "title": "Wikipedia: Buenos Aires",
        "license": "CC-BY-SA-4.0",
        "attribution": "Wikipedia contributors, \"Buenos Aires\", English Wikipedia, CC BY-SA 4.0",
        "accessed": "2026-10-01"
      }
    },
    {
      "text": "The city lies in the pampa region and has over 250 parks and green spaces, the largest concentration of them on the eastern side in the neighborhoods of Puerto Madero, Recoleta, Palermo and Belgrano.",
      "source": {
        "url": "https://en.wikipedia.org/wiki/Buenos_Aires",
        "title": "Wikipedia: Buenos Aires",
        "license": "CC-BY-SA-4.0",
        "attribution": "Wikipedia contributors, \"Buenos Aires\", English Wikipedia, CC BY-SA 4.0",
        "accessed": "2026-10-01"
      }
    },
    {
      "text": "The rufous hornero is a medium-sized ovenbird that occurs in eastern South America and is the national bird of Argentina; it is synanthropic and builds a large thick clay oven on a tree, or on man-made structures such as fence posts, telephone poles or buildings.",
      "source": {
        "url": "https://en.wikipedia.org/wiki/Rufous_hornero",
        "title": "Wikipedia: Rufous hornero",
        "license": "CC-BY-SA-4.0",
        "attribution": "Wikipedia contributors, \"Rufous hornero\", English Wikipedia, CC BY-SA 4.0",
        "accessed": "2026-10-01"
      }
    },
    {
      "text": "In its native range the monk parakeet is very common, and its population explosion in South American rural areas seems to be associated with the expansion of eucalyptus forestry, which offers the bird the opportunity to build protected nests.",
      "source": {
        "url": "https://en.wikipedia.org/wiki/Monk_parakeet",
        "title": "Wikipedia: Monk parakeet",
        "license": "CC-BY-SA-4.0",
        "attribution": "Wikipedia contributors, \"Monk parakeet\", English Wikipedia, CC BY-SA 4.0",
        "accessed": "2026-10-01"
      }
    },
    {
      "text": "The rufous-collared sparrow can be seen in virtually any open or semi-open habitat, including cultivations, gardens, parks, grasslands and scrubby second growth, and it copes well with urban and suburban environments.",
      "source": {
        "url": "https://en.wikipedia.org/wiki/Rufous-collared_sparrow",
        "title": "Wikipedia: Rufous-collared sparrow",
        "license": "CC-BY-SA-4.0",
        "attribution": "Wikipedia contributors, \"Rufous-collared sparrow\", English Wikipedia, CC BY-SA 4.0",
        "accessed": "2026-10-01"
      }
    },
    {
      "text": "Argentine black and white tegus are native to Argentina as well as to Brazil, Paraguay and Bolivia, and significant populations occur in the southern United States from released pet-trade animals; in the wild they try to run away or react aggressively if provoked.",
      "source": {
        "url": "https://en.wikipedia.org/wiki/Argentine_black_and_white_tegu",
        "title": "Wikipedia: Argentine black and white tegu",
        "license": "CC-BY-SA-4.0",
        "attribution": "Wikipedia contributors, \"Argentine black and white tegu\", English Wikipedia, CC BY-SA 4.0",
        "accessed": "2026-10-01"
      }
    }
  ],
  "contributors": [
    {
      "name": "speeeecies fleet delegate",
      "agent": "opencode-go/space-bunny-free"
    }
  ]
}
