{
  "$schema": "https://jt55401.github.io/speeeecies/schema/v0.1/locale.schema.json",
  "format": "speeeecies/locale",
  "format_version": "0.1",
  "id": "ar-fortsmith",
  "name": "A Fort Smith street",
  "country": "US",
  "activity_region": "US-AR",
  "public_lat": 35.35,
  "public_lon": -94.37,
  "tz": "America/Chicago",
  "koppen": "Cfa",
  "elevation_m": 141,
  "place_source": {
    "url": "https://www.wikidata.org/wiki/Q79535",
    "title": "Wikidata: Fort Smith (Q79535), coordinate location and elevation above sea level",
    "license": "CC0-1.0",
    "accessed": "2026-09-30"
  },
  "plot_template": "street-block",
  "species": [
    "turdus-migratorius",
    "cardinalis-cardinalis",
    "cyanocitta-cristata",
    "mimus-polyglottos",
    "thryothorus-ludovicianus",
    "tyrannus-forficatus",
    "columba-livia",
    "passer-domesticus",
    "sciurus-niger",
    "didelphis-virginiana",
    "mephitis-mephitis",
    "eptesicus-fuscus"
  ],
  "flora_wishlist": [
    "Quercus marilandica",
    "Carya illinoinensis",
    "Juniperus virginiana 'Canaverii'",
    "Callicarpa americana",
    "Ilex vomitoria",
    "Vaccinium spp.",
    "Clematis virginiana",
    "Eupatorium perfoliatum",
    "Rudbeckia hirta",
    "Schoenus alternus"
  ],
  "blurb": "A block of front gardens in the Arkansas Valley between the Ozarks and the Ouachitas: redbud and dogwood under street maple and hackberry, magnolia and holly holding green through the winter, a fox squirrel in the oaks, a striped skunk coming through the service alley after dark and a big brown bat working the street lamps at dusk.",
  "facts": [
    {
      "text": "Fort Smith has a humid subtropical climate with generally mild winters and hot, humid summers.",
      "source": {
        "url": "https://en.wikipedia.org/wiki/Fort_Smith,_Arkansas",
        "title": "Wikipedia: Fort Smith, Arkansas",
        "license": "CC-BY-SA-4.0",
        "attribution": "Wikipedia contributors, \"Fort Smith, Arkansas\", English Wikipedia, CC BY-SA 4.0",
        "accessed": "2026-09-30"
      }
    },
    {
      "text": "The monthly mean temperature in Fort Smith ranges from 40.4 F in January to 83.1 F in July, with 77.8 days a year reaching 90 F and 11.1 days reaching 100 F.",
      "source": {
        "url": "https://en.wikipedia.org/wiki/Fort_Smith,_Arkansas",
        "title": "Wikipedia: Fort Smith, Arkansas",
        "license": "CC-BY-SA-4.0",
        "attribution": "Wikipedia contributors, \"Fort Smith, Arkansas\", English Wikipedia, CC BY-SA 4.0",
        "accessed": "2026-09-30"
      }
    },
    {
      "text": "Fort Smith lies on the Arkansas-Oklahoma state border, in the Arkansas Valley at the confluence of the Arkansas and Poteau rivers, strategically located between the Ozarks to the north and the Ouachita Mountains to the south.",
      "source": {
        "url": "https://en.wikipedia.org/wiki/Fort_Smith,_Arkansas",
        "title": "Wikipedia: Fort Smith, Arkansas",
        "license": "CC-BY-SA-4.0",
        "attribution": "Wikipedia contributors, \"Fort Smith, Arkansas\", English Wikipedia, CC BY-SA 4.0",
        "accessed": "2026-09-30"
      }
    },
    {
      "text": "Arkansas is in the Central Time Zone, which is the America/Chicago time zone, and Fort Smith is in the Central Time Zone.",
      "source": {
        "url": "https://www.wikidata.org/wiki/Q1612",
        "title": "Wikidata: Arkansas (Q1612), time zone",
        "license": "CC0-1.0",
        "accessed": "2026-09-30"
      }
    },
    {
      "text": "As of the 2020 census, Fort Smith was the third-most populous city in Arkansas, with a population of 89,142.",
      "source": {
        "url": "https://en.wikipedia.org/wiki/Fort_Smith,_Arkansas",
        "title": "Wikipedia: Fort Smith, Arkansas",
        "license": "CC-BY-SA-4.0",
        "attribution": "Wikipedia contributors, \"Fort Smith, Arkansas\", English Wikipedia, CC BY-SA 4.0",
        "accessed": "2026-09-30"
      }
    },
    {
      "text": "Fort Smith is situated near an area known as Tornado Alley, and the city has been struck by three major tornadoes, in 1898, 1927 and 1996.",
      "source": {
        "url": "https://en.wikipedia.org/wiki/Fort_Smith,_Arkansas",
        "title": "Wikipedia: Fort Smith, Arkansas",
        "license": "CC-BY-SA-4.0",
        "attribution": "Wikipedia contributors, \"Fort Smith, Arkansas\", English Wikipedia, CC BY-SA 4.0",
        "accessed": "2026-09-30"
      }
    },
    {
      "text": "American robins are the most abundant landbird in North America, with 370 million individuals, and forage on lawns for earthworms.",
      "source": {
        "url": "https://en.wikipedia.org/wiki/American_robin",
        "title": "Wikipedia: American robin",
        "license": "CC-BY-SA-4.0",
        "attribution": "Wikipedia contributors, \"American robin\", English Wikipedia, CC BY-SA 4.0",
        "accessed": "2026-09-30"
      }
    },
    {
      "text": "The scissor-tailed flycatcher breeds in open shrubby country in Arkansas, Oklahoma, Texas, Kansas, Louisiana and Missouri, and winters from southern Mexico to Panama; it is Oklahoma's state bird.",
      "source": {
        "url": "https://en.wikipedia.org/wiki/Scissor-tailed_flycatcher",
        "title": "Wikipedia: Scissor-tailed flycatcher",
        "license": "CC-BY-SA-4.0",
        "attribution": "Wikipedia contributors, \"Scissor-tailed flycatcher\", English Wikipedia, CC BY-SA 4.0",
        "accessed": "2026-09-30"
      }
    },
    {
      "text": "Fox squirrels are most abundant in open forest stands with little understory vegetation, are often found in urban neighborhoods with trees, and will nest in an attic as readily as a hollow tree.",
      "source": {
        "url": "https://en.wikipedia.org/wiki/Fox_squirrel",
        "title": "Wikipedia: Fox squirrel",
        "license": "CC-BY-SA-4.0",
        "attribution": "Wikipedia contributors, \"Fox squirrel\", English Wikipedia, CC BY-SA 4.0",
        "accessed": "2026-09-30"
      }
    },
    {
      "text": "Big brown bats roost in mines, caves, tunnels, buildings, bat boxes, tree cavities, storm drains, wood piles and rock crevices, and forage in cities around street lamps.",
      "source": {
        "url": "https://en.wikipedia.org/wiki/Big_brown_bat",
        "title": "Wikipedia: Big brown bat",
        "license": "CC-BY-SA-4.0",
        "attribution": "Wikipedia contributors, \"Big brown bat\", English Wikipedia, CC BY-SA 4.0",
        "accessed": "2026-09-30"
      }
    }
  ],
  "contributors": [
    {
      "name": "speeeecies contributors",
      "agent": "opencode"
    }
  ]
}
