{
  "$schema": "https://jt55401.github.io/speeeecies/schema/v0.1/locale.schema.json",
  "format": "speeeecies/locale",
  "format_version": "0.1",
  "id": "vt-burlington",
  "name": "A Burlington street",
  "country": "US",
  "activity_region": "US-VT",
  "public_lat": 44.48,
  "public_lon": -73.21,
  "tz": "America/New_York",
  "koppen": "Dfa",
  "elevation_m": 61,
  "place_source": {
    "url": "https://www.wikidata.org/wiki/Q31058",
    "title": "Wikidata: Burlington, Vermont (Q31058), coordinate location and elevation above sea level",
    "license": "CC0-1.0",
    "accessed": "2026-10-01"
  },
  "plot_template": "street-block",
  "species": [
    "passer-domesticus",
    "sciurus-carolinensis",
    "turdus-migratorius",
    "poecile-atricapillus",
    "cardinalis-cardinalis",
    "melospiza-melodia",
    "larus-delawarensis",
    "corvus-brachyrhynchos",
    "tamias-striatus",
    "eptesicus-fuscus",
    "thamnophis-sirtalis",
    "cyanocitta-cristata",
    "didelphis-virginiana"
  ],
  "flora_wishlist": [
    "Trillium erectum",
    "Vaccinium angustifolium",
    "Cornus canadensis",
    "Dryopteris carthusiana"
  ],
  "blurb": "A Burlington, Vermont street scene with maples, white pines and birch along the sidewalk, a lawn and a city park: chickadees, jays and a gray squirrel by day, and opossums and a big brown bat after dark.",
  "facts": [
    {
      "text": "Burlington, Vermont has a humid continental climate (Köppen Dfa) with cold, snowy winters and warm, humid summers.",
      "source": {
        "url": "https://en.wikipedia.org/wiki/Burlington%2C_Vermont",
        "title": "Wikipedia: Burlington, Vermont",
        "license": "CC-BY-SA-4.0",
        "attribution": "Wikipedia contributors, \"Burlington, Vermont\", English Wikipedia, CC BY-SA 4.0",
        "accessed": "2026-10-01"
      }
    },
    {
      "text": "Lake Champlain, one of the largest freshwater lakes in the United States, lies between Vermont and New York adjacent to Burlington.",
      "source": {
        "url": "https://en.wikipedia.org/wiki/Lake_Champlain",
        "title": "Wikipedia: Lake Champlain",
        "license": "CC-BY-SA-4.0",
        "attribution": "Wikipedia contributors, \"Lake Champlain\", English Wikipedia, CC BY-SA 4.0",
        "accessed": "2026-10-01"
      }
    },
    {
      "text": "Burlington is Vermont's most populous city, on the eastern shore of Lake Champlain.",
      "source": {
        "url": "https://en.wikipedia.org/wiki/Burlington%2C_Vermont",
        "title": "Wikipedia: Burlington, Vermont",
        "license": "CC-BY-SA-4.0",
        "attribution": "Wikipedia contributors, \"Burlington, Vermont\", English Wikipedia, CC BY-SA 4.0",
        "accessed": "2026-10-01"
      }
    },
    {
      "text": "The nominal average January temperature in Burlington is about 21°F, and the nominal average July temperature is about 71°F.",
      "source": {
        "url": "https://en.wikipedia.org/wiki/Burlington%2C_Vermont",
        "title": "Wikipedia: Burlington, Vermont",
        "license": "CC-BY-SA-4.0",
        "attribution": "Wikipedia contributors, \"Burlington, Vermont\", English Wikipedia, CC BY-SA 4.0",
        "accessed": "2026-10-01"
      }
    }
  ],
  "contributors": [
    {
      "name": "speeeecies agent",
      "agent": "claude-code"
    }
  ]
}
