{
  "$schema": "https://jt55401.github.io/speeeecies/schema/v0.1/locale.schema.json",
  "format": "speeeecies/locale",
  "format_version": "0.1",
  "id": "sydney-au",
  "name": "A Sydney backyard",
  "country": "AU",
  "activity_region": "AU-NSW",
  "public_lat": -33.87,
  "public_lon": 151.21,
  "tz": "Australia/Sydney",
  "koppen": "Cfa",
  "elevation_m": 6,
  "place_source": {
    "url": "https://www.wikidata.org/wiki/Q3130",
    "title": "Wikidata: Sydney (Q3130), coordinate location and elevation above sea level",
    "license": "CC0-1.0",
    "accessed": "2026-10-01"
  },
  "plot_template": "suburban-lot",
  "species": [
    "threskiornis-molucca",
    "manorina-melanocephala",
    "cacatua-galerita",
    "gymnorhina-tibicen",
    "trichoglossus-moluccanus",
    "vanellus-miles",
    "trichosurus-vulpecula",
    "pteropus-poliocephalus",
    "intellagama-lesueurii",
    "tiliqua-scincoides",
    "litoria-peronii"
  ],
  "flora_wishlist": [
    "Eucalyptus saligna",
    "Ficus macrophylla",
    "Banksia integrifolia",
    "Callistemon salignus",
    "Syzygium smithii",
    "Jacaranda mimosifolia",
    "Livistona australis",
    "Camellia japonica"
  ],
  "blurb": "A suburban backyard in Sydney: a lawn, a border of bottlebrush and lilli pilli, a tall gum tree and a fig, visited by ibises, magpies, lorikeets and possums by day and by flying-foxes and tree frogs after dark.",
  "facts": [
    {
      "text": "Sydney has a humid subtropical climate (Köppen Cfa) with warm summers and mild winters.",
      "source": {
        "url": "https://en.wikipedia.org/wiki/Sydney",
        "title": "Wikipedia: Sydney",
        "license": "CC-BY-SA-4.0",
        "attribution": "Wikipedia contributors, \"Sydney\", English Wikipedia, CC BY-SA 4.0",
        "accessed": "2026-10-01"
      }
    },
    {
      "text": "The Australian white ibis has become a common sight in Sydney's parks and shopping centre carparks since moving into urban areas in the 1970s.",
      "source": {
        "url": "https://en.wikipedia.org/wiki/Australian_white_ibis",
        "title": "Wikipedia: Australian white ibis",
        "license": "CC-BY-SA-4.0",
        "attribution": "Wikipedia contributors, \"Australian white ibis\", English Wikipedia, CC BY-SA 4.0",
        "accessed": "2026-10-01"
      }
    },
    {
      "text": "The grey-headed flying-fox is listed as vulnerable under federal law; Sydney's botanic gardens host one of the largest urban roosts.",
      "source": {
        "url": "https://en.wikipedia.org/wiki/Grey-headed_flying_fox",
        "title": "Wikipedia: Grey-headed flying fox",
        "license": "CC-BY-SA-4.0",
        "attribution": "Wikipedia contributors, \"Grey-headed flying fox\", English Wikipedia, CC BY-SA 4.0",
        "accessed": "2026-10-01"
      }
    },
    {
      "text": "The common brushtail possum is one of the Australian marsupials most often seen by city dwellers, denning in tree hollows and house roofs.",
      "source": {
        "url": "https://en.wikipedia.org/wiki/Common_brushtail_possum",
        "title": "Wikipedia: Common brushtail possum",
        "license": "CC-BY-SA-4.0",
        "attribution": "Wikipedia contributors, \"Common brushtail possum\", English Wikipedia, CC BY-SA 4.0",
        "accessed": "2026-10-01"
      }
    },
    {
      "text": "The Australian magpie's carolling song is one of the most recognisable bird calls in Australia; males swoop to defend their nests in spring.",
      "source": {
        "url": "https://en.wikipedia.org/wiki/Australian_magpie",
        "title": "Wikipedia: Australian magpie",
        "license": "CC-BY-SA-4.0",
        "attribution": "Wikipedia contributors, \"Australian magpie\", English Wikipedia, CC BY-SA 4.0",
        "accessed": "2026-10-01"
      }
    }
  ],
  "contributors": [
    {
      "name": "speeeecies maintainers",
      "agent": "opencode"
    }
  ]
}
